student_id,task_id,draft_no,submission_date,word_count,essay_text
9263,task_1,1,"2026-04-01T12:33:17.587Z",112,"In recent years, education has changed significantly due to technological advancements. The most discussed topic today is the comparison between online learning and onsite learning. While onsite learning has been the dominant form of education for many decades, online learning has become increasingl"
9263,task_2,2,"2026-04-01T12:33:17.587Z",112,"In recent years, education has changed significantly due to rapid technological advancements. One of the most discussed topics today is the comparison between online learning and onsite learning. While onsite learning has been the dominant form of education for many decades, online learning has beco"
9263,task_3,3,"2026-04-01T12:33:17.587Z",186,"One important concern about using Artificial Intelligence in higher education is that students may start depending on it too much. AI is meant to support learning, but when it becomes the main source for doing assignments, it can slowly weaken important skills like critical thinking and problem solv"
9263,task_4,4,"2026-04-01T12:33:17.588Z",186,"One important concern about using Artificial Intelligence in higher education is that students may start leaning on it too much. AI is meant to support learning, but when it becomes the main source for doing assignments, it can slowly weaken important skills like critical thinking and problem solvin"
9263,task_5,5,"2026-04-01T12:33:17.588Z",150,"The use of intelligence in universities has a serious problem. Artificial intelligence can affect how honest students are when they do their work. Artificial intelligence tools can help students generate ideas or understand concepts. However when students use intelligence tools in the wrong way it b"
9263,task_6,6,"2026-04-01T12:33:17.588Z",198,"Another major worry is how AI impacts fairness and student relationships. Some students use AI a lot to do their assignments while others do their work on their own it can make school unfair. Students who take time to research write and revise their work might feel discouraged when they see others g"